,type,date(yyyyMMddHHmmss),author,message,latitude,longitude, location
1060,mbdata,20140123193000,martaO,now 1/2 hour late pleasedontgiveuponm imreallypromptmostofthetim,,,
1061,mbdata,20140123193000,anaregents,viktor e rock,,,
1062,mbdata,20140123193000,sofitees,@carlyscoffe best coffe abila,36.059,24.857,
1063,ccdata,20140123193000,,traffic stop,,,3701 Polvo St
1064,mbdata,20140123193010,Clevvah4Evah,the ralli peak interest pok ralli grammar,,,
1065,mbdata,20140123193010,KronosQuoth,there traffic jam along extra mile   kronosstar pokral,,,
1066,mbdata,20140123193010,KronosQuoth,there one way avoid critic noth say noth noth   kronosstar pokral,,,
1067,mbdata,20140123193013,teresaJ,rt @kronosstar the fire marshal decid evacu addit build kronosstar dancingdolphinfir,,,
1068,mbdata,20140123193013,wiseWords,rt @kronosstar the fire marshal decid evacu addit build kronosstar dancingdolphinfir,,,
1069,mbdata,20140123193013,farmboy,rt @centralbulletin expans evacu perimet abila fire abila centralbulletin,,,
1070,mbdata,20140123193013,ninjabob,rt @centralbulletin expans evacu perimet abila fire abila centralbulletin,,,
1071,mbdata,20140123193032,KronosQuoth,the success warrior averag man laser like focus   pokral hi,,,
1072,mbdata,20140123193032,KronosQuoth,the futur heal descript marvel pokral hi,,,
1073,mbdata,20140123193054,KronosQuoth,a person never made mistak never tri anyth new   kronosstar pokral,,,
1074,mbdata,20140123193100,phantomagate,rt @internationalnew neighborhood evacu danc dolphin fire abila intnew,,,
1075,mbdata,20140123193100,muppiesRock,rt @internationalnew neighborhood evacu danc dolphin fire abila intnew,,,
1076,mbdata,20140123193100,vetsRock,rt @internationalnew neighborhood evacu danc dolphin fire abila intnew,,,
1077,mbdata,20140123193100,plasticParts,rt @newsonlinetoday addit resid evacu danc dolphin fire abila newsonlin,,,
1078,mbdata,20140123193100,sarajane,rt @martao now 1/2 hour late pleasedontgiveuponm imreallypromptmostofthetim,,,
1079,mbdata,20140123193100,BlueVelvet,rt @sofite @carlyscoffe best coffe abila,,,
1080,mbdata,20140123193124,junkman995,i lost bunch weight stuff work look news articl diet.kronos/starvenow   abila bestfood,,,
1081,mbdata,20140123193124,KronosQuoth,failur condiment give success flavor   pokral hi,,,
1082,mbdata,20140123193124,Clevvah4Evah,alway flush idea present pok ralli grammar,,,
1083,mbdata,20140123193124,KronosQuoth,you without sin cast first stone   kronosstar pokral,,,
1084,mbdata,20140123193148,KronosQuoth,limit live mind   but use imagin possibl becom limitless   kronosstar pokral,,,
1085,mbdata,20140123193148,Clevvah4Evah,alway flush idea present pok ralli grammar,,,
1086,mbdata,20140123193212,KronosQuoth,in order succeed desir success greater fear failur   kronosstar pokral,,,
1087,mbdata,20140123193212,KronosQuoth,success sum small effort repeat day day   pokral hi,,,
1088,mbdata,20140123193212,KronosQuoth,the best time plant tree 20 year ago the second best time   kronosstar pokral,,,
1089,mbdata,20140123193241,junkman995,time refil refil med onlin drugs.kronos/cheappil abila pharmacyripoff,,,
1090,mbdata,20140123193241,hotdrugs225,hi i advis visit link hottips.kronos/trad abila,,,
1091,mbdata,20140123193241,KronosQuoth,onli put tomorrow will die left undon   pokral hi,,,
1092,mbdata,20140123193302,KronosQuoth,a person never made mistak never tri anyth new   kronosstar pokral,,,
1093,mbdata,20140123193302,KronosQuoth,the best time plant tree 20 year ago the second best time   kronosstar pokral,,,
1094,mbdata,20140123193302,KronosQuoth,fall seven time stand eight   kronosstar pokral,,,
1095,mbdata,20140123193325,KronosQuoth,knowledg awar wisdom know   pokral hi,,,
1096,mbdata,20140123193325,KronosQuoth,i find real interest life curious life sleep import thing   pokral hi,,,
1097,mbdata,20140123193325,Clevvah4Evah,you penultim girlfriend pok ralli grammar,,,
1098,mbdata,20140123193346,KronosQuoth,the one crazi enough think chang world one   pokral hi,,,
1099,mbdata,20140123193400,microBanana,rt @michel see photoalbum account pic dancingdolphinfir,,,
1100,mbdata,20140123193411,KronosQuoth,if want achiev excel get today as second quit less excel work   pokral hi,,,
1101,mbdata,20140123193411,KronosQuoth,if will risk usual settl ordinari   pokral hi,,,
1102,mbdata,20140123193411,KronosQuoth,life find life creat   pokral hi,,,
1103,mbdata,20140123193432,KronosQuoth,the question nt go let go stop   kronosstar pokral,,,
1104,mbdata,20140123193454,KronosQuoth,you never cross ocean courag lose sight shore   kronosstar pokral,,,
1105,mbdata,20140123193507,AbilaPost,anoth polic unit dispatch help hous hous evacuation?#abilapost,,,
1106,mbdata,20140123193507,OnlytheTruth,look em run,,,
1107,mbdata,20140123193507,hngohebo_ABILAPOST,bicyclist hit run accid 500 block schaber uninjur abilapost,,,
1108,mbdata,20140123193507,KronosStar,the bicyclist 500 block schaber accid uninjur   kronosstar,,,
1109,mbdata,20140123193507,AbilaPoliceDepartment,abila polic depart report pursuit suspect hit run vehicl pursuit head west egeou?#apd,,,
1110,mbdata,20140123193507,trapanitweets,henri -bike guy- done talk copper look trash bike,36.054,24.901,
1111,mbdata,20140123193507,brewvebeenserved,go give biker coffe he 's bean serv,36.054,24.901,
1112,ccdata,20140123193507,,reckless hazarad driver in progress,,,Egeou Ave / Polvo St
1113,mbdata,20140123193522,KronosQuoth,think becom capit asset matter whatev up down come across life   pokral hi,,,
1114,mbdata,20140123193522,Clevvah4Evah,in edit alway add instead multipli pok ralli grammar,,,
1115,mbdata,20140123193522,KronosQuoth,rememb get want sometim wonder stroke luck   kronosstar pokral,,,
1116,mbdata,20140123193547,KronosQuoth,peopl often say motiv n't last well neither bath 's recommend daili   pokral hi,,,
1117,mbdata,20140123193547,KronosQuoth,noth world common unsuccess peopl talent   pokral hi,,,
1118,ccdata,20140123193558,,pursuit polic unit 253 in pursuit,,,Egeou Ave / Nia Ave
1119,mbdata,20140123193600,AbilaPost,if vicin achilleo madeg pleas evacu donot wait fire polic offic abilapost,,,
1120,mbdata,20140123193600,AbilaAllFaith,donat dancingdolphinsfir victim accept generousabila,,,
1121,mbdata,20140123193600,martaO,whi nt answer phone notthatintom,,,
1122,mbdata,20140123193600,trollingsnark,evacu right mean @abilapost,,,
1123,mbdata,20140123193600,stuffNstuff,cyclist safeti meet eastabila cycl,,,
1124,mbdata,20140123193600,KronosStar,abila polic pursuit errat driver ran red light polvo   kronosstar,,,
1125,mbdata,20140123193600,HomelandIlluminations,report come possibl hit run polic pursuit hi,,,
1126,mbdata,20140123193600,trapanitweets,i think 's cri,36.054,24.901,
1127,mbdata,20140123193600,surferMan,some dude blast red light cop pursuit gonnagetit,,,
1128,mbdata,20140123193600,Officia1AbilaPost,the untold link pok gastech smad.co.kronos/b33nk4x,,,
1129,ccdata,20140123193600,,pursuit continu polic unit 253 and 357 second unit join,,,Egeou Ave / Limnou St
1130,mbdata,20140123193610,KronosQuoth,too mani us live dream live fear   kronosstar pokral,,,
1131,mbdata,20140123193610,KronosQuoth,you take life hand happen a terribl thing one blame   kronosstar pokral,,,
1132,mbdata,20140123193610,KronosQuoth,wast want   kronosstar pokral,,,
1133,mbdata,20140123193641,KronosQuoth,you ca nt fall nt climb   but joy live whole life ground   kronosstar pokral,,,
1134,mbdata,20140123193641,KronosQuoth,the battl count nt one gold medal the struggl within kronosstar pokral,,,
1135,mbdata,20140123193700,slamrjamr,rt @abilapost if vicin achilleo madeg pleas evacu donot wait fire polic offic abilapost,,,
1136,mbdata,20140123193700,soup4u,rt @abilapost if vicin achilleo madeg pleas evacu donot wait fire polic offic abilapost,,,
1137,mbdata,20140123193700,BlueVelvet,rt @kronosstar abila polic pursuit errat driver ran red light polvo   kronosstar,,,
1138,mbdata,20140123193700,sithLordJames,rt @kronosstar abila polic pursuit errat driver ran red light polvo   kronosstar,,,
1139,mbdata,20140123193700,vetsRock,rt @homelandillumin report come possibl hit run polic pursuit hi,,,
1140,mbdata,20140123193700,worldWatcher,rt @homelandillumin report come possibl hit run polic pursuit hi,,,
1141,ccdata,20140123193700,,suspici occupi vehicl black van,,,S. Limnou St / S. Eleftherias St
1142,mbdata,20140123193705,KronosQuoth,whether think think ca nt right   kronosstar pokral,,,
1143,mbdata,20140123193705,KronosQuoth,it place world life go make life want live   kronosstar pokral,,,
1144,mbdata,20140123193730,KronosQuoth,definit purpos start point achiev   kronosstar pokral,,,
1145,mbdata,20140123193730,KronosQuoth,be miser or motiv whatev done 's alway choic   pokral hi,,,
1146,mbdata,20140123193730,KronosQuoth,when doubt punt   kronosstar pokral,,,
1147,mbdata,20140123193752,KronosQuoth,i learn year one mind made diminish fear   kronosstar pokral,,,
1148,mbdata,20140123193752,KronosQuoth,motiv get start habit keep go   pokral hi,,,
1149,mbdata,20140123193800,sarajane,rt @abilapost if vicin achilleo madeg pleas evacu donot wait fire polic offic abilapost,,,
1150,mbdata,20140123193800,phantomagate,rt @homelandillumin report come possibl hit run polic pursuit hi,,,
1151,mbdata,20140123193800,farmboy,rt @homelandillumin report come possibl hit run polic pursuit hi,,,
1152,mbdata,20140123193800,brain448,rt @trapanitweet i think 's cri,,,
1153,mbdata,20140123193800,electricAvenue,rt @officia1abilapost the untold link pok gastech smad.co.kronos/b33nk4x,,,
1154,mbdata,20140123193807,plasticParts,rt @hngohebo_abilapost bicyclist hit run accid 500 block schaber uninjur abilapost,,,
1155,mbdata,20140123193807,klingon4real,rt @abilapolicedepart abila polic depart report pursuit suspect hit run vehicl pursuit head west egeou?#apd,,,
1156,ccdata,20140123193822,,suspici occupi vehicl black van,,,N. Limnou St / N. Achilleos St
1157,mbdata,20140123193822,KronosQuoth,whenev find side major time paus reflect   pokral hi,,,
1158,mbdata,20140123193822,KronosQuoth,the best reason start organ make mean creat product servic make world better place   pokral hi,,,
1159,mbdata,20140123193822,maskedWoman101,i recommend site abila dates.kronos/clickher,,,
1160,mbdata,20140123193822,junkman995,free ith contest click contest.kronos/freeith   abila ith,,,
1161,mbdata,20140123193848,meds4realz43,hi i advis visit link hottips.kronos/trad abila,,,
1162,mbdata,20140123193848,KronosQuoth,whenev see success person see public glori never privat sacrific reach   pokral hi,,,
1163,mbdata,20140123193848,KronosQuoth,our live begin end day becom silent thing matter   kronosstar pokral,,,
1164,mbdata,20140123193900,plasticParts,rt @abilapost if vicin achilleo madeg pleas evacu donot wait fire polic offic abilapost,,,
1165,mbdata,20140123193900,henri,rt @abilapost if vicin achilleo madeg pleas evacu donot wait fire polic offic abilapost,,,
1166,mbdata,20140123193900,plasticParts,rt @abilapost if vicin achilleo madeg pleas evacu donot wait fire polic offic abilapost,,,
1167,mbdata,20140123193900,henri,rt @kronosstar abila polic pursuit errat driver ran red light polvo   kronosstar,,,
1168,mbdata,20140123193900,lordWally,rt @homelandillumin report come possibl hit run polic pursuit hi,,,
1169,mbdata,20140123193900,electricAvenue,rt @homelandillumin report come possibl hit run polic pursuit hi,,,
1170,mbdata,20140123193900,klingon4real,rt @homelandillumin report come possibl hit run polic pursuit hi,,,
1171,mbdata,20140123193907,rnbwBrite,rt @brewvebeenserv go give biker coffe he 's bean serv,,,
1172,mbdata,20140123193907,redisrad,ominousknock,,,
1173,mbdata,20140123193907,trapanitweets,coffe shop owner gave henri coffe yay abila nice peopl,36.054,24.901,
1174,ccdata,20140123193907,,pursuit continu polic unit 253 and 357,,,N. Limnou St / N. Alexandrias St
1175,mbdata,20140123193909,KronosQuoth,the two import day life day born day find   kronosstar pokral,,,
1176,mbdata,20140123193932,KronosQuoth,do n't let interfer   pokral hi,,,
1177,mbdata,20140123193940,redisrad,scari look apd say evacu,,,
1178,mbdata,20140123193940,kingWilly,siren go give nightmar afd apd,,,
1179,mbdata,20140123193940,trapanitweets,except derp hit henri,36.054,24.901,
1180,mbdata,20140123193940,brewvebeenserved,our awesom coffe cheer he 's ok now,36.054,24.901,
1181,mbdata,20140123193940,megaMan,run n't walk across driveway gelato almostcreamedbyvan,,,
1182,mbdata,20140123193940,prettyRain,someth go outsid 'm gelatogalor,,,
1183,mbdata,20140123193940,sofitees,wow crazi drive @gelatogalor somebodywantgelatobad,36.059,24.857,
1184,ccdata,20140123193940,,incomplet call for polic,,,
1185,mbdata,20140123193953,KronosQuoth,you must expect great thing   pokral hi,,,
1186,mbdata,20140123193953,KronosQuoth,whenev find side major time paus reflect   pokral hi,,,
1187,mbdata,20140123193953,Clevvah4Evah,wait bate breadth pok ralli grammar,,,
1188,mbdata,20140123193953,dirtdigger334,make $ 630-$8062 month onlin fastjobs.kronos/trick abila workathom,,,
1189,mbdata,20140123194000,blueSunshine,rt @abilapost if vicin achilleo madeg pleas evacu donot wait fire polic offic abilapost,,,
1190,mbdata,20140123194000,pinky,rt @abilaallfaith donat dancingdolphinsfir victim accept generousabila,,,
1191,mbdata,20140123194000,dragonRider1,rt @kronosstar abila polic pursuit errat driver ran red light polvo   kronosstar,,,
1192,mbdata,20140123194000,brain448,rt @homelandillumin report come possibl hit run polic pursuit hi,,,
1193,mbdata,20140123194000,redisrad,yessir,,,
1194,mbdata,20140123194000,martaO,wheezi panickattak worstfirstdateev,,,
1195,mbdata,20140123194000,truccotrucco,wow crazi black van got pull park lot dinner show,36.059,24.856,
1196,mbdata,20140123194000,KronosStar,abila polic corner errat driver park lot near intersect alexandria ithaki shot fire kronosstar,,,
1197,mbdata,20140123194000,trapanitweets,gon na help bike guy home ttl,36.054,24.901,
1198,mbdata,20140123194000,protoGuy,omg dude black van shoot cop   bullet everywher,,,
1199,mbdata,20140123194000,megaMan,yeah van ca n't exit backway gelato   and cop got,,,
1200,mbdata,20140123194000,panopticon,somebodi shoot across street gelatogalor went octavio ink cartridg,,,
1201,mbdata,20140123194000,SiaradSea,real life action movi go outsid most excit milk run ever,,,
1202,mbdata,20140123194000,roger_roger,someth 's go outsid i think i heard gun,,,
1203,mbdata,20140123194000,sofitees,cops?r right behind think gunshot crazi,36.059,24.857,
1204,ccdata,20140123194000,,feloni assault weapon in progress,,,N. Alexandrias St / N. Ithakis St
1205,mbdata,20140123194021,reggierockin776,i got cheap medic onlin without prescript meds.kronos/cheapm krono abila,,,
1206,mbdata,20140123194022,brontes_riff,omg the cop are here for me,,,
1207,mbdata,20140123194022,megaMan,better expect cop block van gelato move get better view,,,
1208,mbdata,20140123194022,HomelandIlluminations,break news abila polic report shot fire gelato galor near citi park,,,
1209,mbdata,20140123194022,prettyRain,cop outsid think 's someth wrong,,,
1210,mbdata,20140123194022,roger_roger,told us stay down- re floor i 'm ok,,,
1211,mbdata,20140123194022,Simon_Hamaeth,i 'd swear heard gunshot @carlyscoffe,,,
1212,ccdata,20140123194022,,disturb nois,,,1615 N. Omirou St
1213,mbdata,20140123194029,protoGuy,go move i get better view,,,
1214,mbdata,20140123194029,megaMan,so van tri turn exit cop block van cop door open troubleatgelato,,,
1215,mbdata,20140123194029,HomelandIlluminations,moment ago shot fire corner ithaki alexandria,,,
1216,mbdata,20140123194029,NewsOnlineToday,abila polic report shot fire busi abila,,,
1217,mbdata,20140123194029,jsmith,omc happen citi fire shoot kidnap repent,,,
1218,mbdata,20140123194029,panopticon,hink somedbi got shot cnat tell exact,,,
1219,mbdata,20140123194029,SiaradSea,yike gunfir hide behind watermelon,,,
1220,mbdata,20140123194029,roger_roger,i 'm with?som peopl re hide behind counter,,,
1221,mbdata,20140123194041,truccotrucco,omg shoot shoot,36.059,24.856,
1222,mbdata,20140123194041,megaMan,shot move behind mailbox peek troubleatgelato,,,
1223,mbdata,20140123194041,AbilaPost,report gun fire gelatogalor apd scene abilapost,,,
1224,mbdata,20140123194041,SiaradSea,move freezer section better protect,,,
1225,mbdata,20140123194041,prettyRain,someon sai get floor pleas send help,,,
1226,mbdata,20140123194041,roger_roger,wth did ralli get?viol,,,
1227,mbdata,20140123194041,sofitees,think cop got shot down?n might dead,36.059,24.857,
1228,ccdata,20140123194041,,suspici occupi vehicl black van,,,3611 N. Berlau St
1229,mbdata,20140123194051,KronosQuoth,success peopl unsuccess peopl will dodon't wish easier wish better   pokral hi,,,
1230,mbdata,20140123194100,stolkfair,rt @kronosstar abila polic corner errat driver park lot near intersect alexandria ithaki shot fire kronosstar,,,
1231,mbdata,20140123194100,FriendsOfKronos,gunfir gelatogalor give ya one guess pok terrorist,,,
1232,mbdata,20140123194100,protoGuy,omg cop got hit 's blood everywher,,,
1233,mbdata,20140123194100,Sara_Nespola,somebodi shoot us,,,
1234,mbdata,20140123194100,megaMan,@ben bullet ca n't go thru mailbox thanks4noth,,,
1235,mbdata,20140123194100,CentralBulletin,report gun fire abila busi abila centralbulletin,,,
1236,mbdata,20140123194100,SiaradSea,i think cop got hit,,,
1237,mbdata,20140123194100,prettyRain,still 's lot polic 's go,,,
1238,mbdata,20140123194100,roger_roger,i hear siren chout outsid,,,
1239,ccdata,20140123194100,,suspici subject circumst in progress,,,3107 N. Alexandrias St
1240,mbdata,20140123194103,truccotrucco,happen r right front shoot,36.059,24.856,
1241,mbdata,20140123194107,FriendsOfKronos,abila come use peac citi pok start peac movement pok terror,,,
1242,mbdata,20140123194107,megaMan,black van face two cop car shot fire peopl undercov move control troubleatgelato,,,
1243,mbdata,20140123194107,yomamma,scare death i go go gelato i could right,,,
1244,mbdata,20140123194107,roger_roger,'s go,,,
1245,mbdata,20140123194107,Simon_Hamaeth,i think cop got shot right outsid carlyscoffe apd,,,
1246,ccdata,20140123194107,,traffic stop,,,2708 N. Polvo St
1247,mbdata,20140123194113,truccotrucco,never scare tabl gelatogalor ca nt see much cop light,36.059,24.856,
1248,mbdata,20140123194113,protoGuy,go get behind wall,,,
1249,mbdata,20140123194113,megaMan,@ben @georg ca n't see van yet one cop,,,
1250,mbdata,20140123194113,panopticon,nooooo cop got kill shooter still gelatogalor park lot,,,
1251,mbdata,20140123194113,roger_roger,guy peek window?- lot peopl outsid,,,
1252,mbdata,20140123194120,KronosQuoth,take one idea make one idea life think dream live idea   pokral hi,,,
1253,mbdata,20140123194120,KronosQuoth,success walk failur failur loss enthusiasm   pokral hi,,,
1254,mbdata,20140123194120,Clevvah4Evah,in edit alway add instead multipli pok ralli grammar,,,
1255,mbdata,20140123194120,KronosQuoth,noth world common unsuccess peopl talent   pokral hi,,,
1256,mbdata,20140123194122,protoGuy,hope cop n't dead,,,
1257,mbdata,20140123194122,megaMan,cop troubleatgelato,,,
1258,mbdata,20140123194122,SiaradSea,this crazi whi didt'n iwait toget later,,,
1259,mbdata,20140123194122,roger_roger,wtf say someon 's dead outsid,,,
1260,ccdata,20140123194122,,alarm secur no crime,,,5101 N. Carden St
1261,mbdata,20140123194129,sithLordJames,rt @homelandillumin moment ago shot fire corner ithaki alexandria,,,
1262,mbdata,20140123194129,megaMan,still ca n't tell keep head troubleatgelato,,,
1263,mbdata,20140123194129,roger_roger,someon tell cop re,,,
1264,ccdata,20140123194129,,suspici occupi vehicl black van,,,N. Oddisseos St / N. Antoniadou St
1265,mbdata,20140123194133,truccotrucco,nt stay ralli trap van right outsdi door,36.059,24.856,
1266,mbdata,20140123194133,dtrejos,sometth bad 's go downtown anyon detail,,,
1267,mbdata,20140123194133,protoGuy,cop van dude hide behind door like movi,,,
1268,mbdata,20140123194133,megaMan,van guy behind door cop troubleatgelato,,,
1269,mbdata,20140123194133,windAvatar,guess someon didhn't get good servid gelato galore-- overreact,,,
1270,mbdata,20140123194140,dolls4sale,rt @sofite wow crazi drive @gelatogalor somebodywantgelatobad,,,
1271,mbdata,20140123194141,jaques,rt @truccotrucco omg shoot shoot,,,
1272,mbdata,20140123194141,stolkfair,rt @abilapost report gun fire gelatogalor apd scene abilapost,,,
1273,mbdata,20140123194141,slamrjamr,rt @siaradsea move freezer section better protect,,,
1274,mbdata,20140123194142,megaMan,ca n't see other van troubleatgelato tag,,,
1275,mbdata,20140123194143,KronosQuoth,if want lift lift someon els   kronosstar pokral,,,
1276,mbdata,20140123194145,supplementsRule,ll laugh see pic hotchicks.kronos/pictur hot onfir,,,
1277,mbdata,20140123194145,truccotrucco,i see outsid know kill,36.059,24.856,
1278,mbdata,20140123194145,megaMan,n't think anyon ran didn'thav time polic pull tag,,,
1279,mbdata,20140123194145,AbilaPost,unconfirm report offic result gun fire gelatogalor park lot abilapost,,,
1280,mbdata,20140123194145,KronosStar,shot fire gelato galor polic offic kronosstar,,,
1281,mbdata,20140123194145,HomelandIlluminations,there flurri activ near gelato galor polic hold multipl gunman,,,
1282,mbdata,20140123194145,prettyRain,omgomgomg 'm scare -someon dead,,,
1283,mbdata,20140123194145,roger_roger,wth did stupid ralli get?viol,,,
1284,mbdata,20140123194148,truccotrucco,everyon hide guy reach grab food eat time like,36.059,24.856,
1285,mbdata,20140123194148,protoGuy,shot cop still ground n't anyon help,,,
1286,mbdata,20140123194148,megaMan,lot peopl took cover get behind someth folk tag,,,
1287,mbdata,20140123194148,CentralBulletin,report offic result gun fire abila busi gelatogalor abila centralbulletin,,,
1288,mbdata,20140123194148,HomelandIlluminations,wit report gunmen hostag,,,
1289,mbdata,20140123194148,Officia1AbilaPost,eight surpris fact gelatogalor empir snad.co.kronos/38cnik34,,,
1290,mbdata,20140123194148,Simon_Hamaeth,i hope someon know re trap helpus apd,,,
1291,ccdata,20140123194148,,subject stop,,,3277 N. Agentes St
1292,mbdata,20140123194157,FriendsOfKronos,cop shot gelatogalor pok terrorist knew matter time pok terror,,,
1293,mbdata,20140123194157,megaMan,@ben report shown sure,,,
1294,mbdata,20140123194157,NewsOnlineToday,wit report polic hold multipl gunmen abila,,,
1295,ccdata,20140123194157,,fire medic need offic down,,,N. Alexandrias St / N. Ithakis St
1296,mbdata,20140123194200,phantomagate,rt @kronosstar abila polic corner errat driver park lot near intersect alexandria ithaki shot fire kronosstar,,,
1297,mbdata,20140123194200,vetsRock,rt @kronosstar abila polic corner errat driver park lot near intersect alexandria ithaki shot fire kronosstar,,,
1298,mbdata,20140123194200,vetsRock,rt @siaradsea real life action movi go outsid most excit milk run ever,,,
1299,mbdata,20140123194203,truccotrucco,omg abila post say cop got shot happen,36.059,24.856,
1300,mbdata,20140123194203,FriendsOfKronos,cop kill pok terorist violenc stop pok terror,,,
1301,mbdata,20140123194203,megaMan,still take peek stayingbehindmymailbox tag,,,
1302,mbdata,20140123194203,NewsOnlineToday,wit report gunmen hostag abila,,,
1303,mbdata,20140123194211,kingWilly,just left coffe store omg could pray peopl still,,,
1304,mbdata,20140123194211,protoGuy,lot peopl store know danger,,,
1305,mbdata,20140123194211,megaMan,lot peopl trap insid gelato idiot stand go get shot tag,,,
1306,mbdata,20140123194211,hempRules,everyon stay indoor 's someon shoot peopl gelato galor   do n't go outsid,,,
1307,mbdata,20140123194211,KronosQuoth,rememb one make feel inferior without consent   kronosstar pokral,,,
1308,mbdata,20140123194211,KronosQuoth,life nt get give   kronosstar pokral,,,
1309,mbdata,20140123194211,KronosQuoth,a person never made mistak never tri anyth new   kronosstar pokral,,,
1310,mbdata,20140123194211,Clevvah4Evah,the ralli peak interest pok ralli grammar,,,
1311,mbdata,20140123194214,truccotrucco,stupid guy stand look window want get shot,36.059,24.856,
1312,mbdata,20140123194214,megaMan,light gelato park lot hard see clear tag,,,
1313,ccdata,20140123194214,,suspici occupi vehicl black van,,,1492 N. Lumen St
1314,mbdata,20140123194222,lordWally,rt @homelandillumin break news abila polic report shot fire gelato galor near citi park,,,
1315,mbdata,20140123194222,soup4u,rt @homelandillumin break news abila polic report shot fire gelato galor near citi park,,,
1316,mbdata,20140123194222,blueSunshine,rt @homelandillumin break news abila polic report shot fire gelato galor near citi park,,,
1317,mbdata,20140123194222,truccotrucco,sit pls,36.059,24.856,
1318,mbdata,20140123194222,megaMan,headlight car focus tag,,,
1319,mbdata,20140123194222,InternationalNews,break news abila shot fire gelato galor polic offic intnew,,,
1320,ccdata,20140123194222,,check on hazard,,,6007 N. Artakis St
1321,mbdata,20140123194228,truccotrucco,nt heard shot pls shoot,36.059,24.856,
1322,mbdata,20140123194228,unicorns,omg standoff i left town everyth goe pot,,,
1323,mbdata,20140123194228,protoGuy,shoot wait someon make move,,,
1324,mbdata,20140123194228,KronosStar,govern offici tell peopl pleas stay away crime scene kronosstar,,,
1325,ccdata,20140123194228,,fire medic need ambul dispatch,,,N. Alexandrias St / N. Ithakis St
1326,mbdata,20140123194229,sarajane,rt @homelandillumin moment ago shot fire corner ithaki alexandria,,,
1327,mbdata,20140123194229,brandonL,rt @siaradsea yike gunfir hide behind watermelon,,,
1328,mbdata,20140123194234,Clevvah4Evah,i would like return complement pok ralli grammar,,,
1329,mbdata,20140123194234,KronosQuoth,you may succeed desir succeed may fail mind fail   pokral hi,,,
1330,mbdata,20140123194241,jgrobannne,rt @roger_rog wth did ralli get?viol,,,
1331,mbdata,20140123194245,rnbwBrite,rt @abilapost unconfirm report offic result gun fire gelatogalor park lot abilapost,,,
1332,mbdata,20140123194245,electricAvenue,rt @abilapost unconfirm report offic result gun fire gelatogalor park lot abilapost,,,
